{
  "apiVersion": "1",
  "id": "image-compare-viewer",
  "namespace": "integral",
  "displayName": "Image Compare Viewer",
  "version": "0.1.0",
  "description": "位置合わせ済み画像セットを切替・重ね表示する .icv viewer",
  "viewers": [
    {
      "id": "icv",
      "displayName": "Image Compare",
      "description": ".icv image comparison manifest viewer",
      "extensions": [".icv"],
      "renderer": {
        "entry": "renderer/index.html",
        "mode": "iframe"
      }
    }
  ]
}
